{
  "schema_version": "0.1.0",
  "instrument_id": "urn:lex-mx:federal:regulation:reg-lfmzaah",
  "operational_source": "camara_de_diputados",
  "formal_publication_source": "dof",
  "publisher": "Cámara de Diputados del H. Congreso de la Unión",
  "official_url": "https://www.diputados.gob.mx/LeyesBiblio/regley/Reg_LFMZAAH_031220.pdf",
  "reference_url": "https://www.diputados.gob.mx/LeyesBiblio/regley/Reg_LFMZAAH_031220.pdf",
  "retrieved_at": "2026-10-14T07:53:01.346077Z",
  "http_status": 200,
  "content_type": "application/pdf",
  "content_length": 275110,
  "etag": "\"432a6-5b5f6fafcb140\"",
  "last_modified": "Tue, 08 Dec 2020 17:07:41 GMT",
  "source_sha256": "2fcb89f7d62bcd28ba179647dee39dd5c28437ebc8bcdb13ce6924b36b20b9e6",
  "extracted_text_sha256": "669e9f14ebfec16091ef9505327755da0af5edabf33f56357e44eecf8ef38a42",
  "extraction_tool": "pdftotext version 26.09.0",
  "parser_version": "0.1.0",
  "schema_version_used": "0.1.0",
  "resulting_git_commit": "1a37ccde2e113e550d08a82bbead5620c9b6d868"
}