{
  "schema_version": "0.1.0",
  "instrument_id": "urn:lex-mx:federal:regulation:reg-lgs-mcspiumc",
  "operational_source": "camara_de_diputados",
  "formal_publication_source": "dof",
  "publisher": "Cámara de Diputados del H. Congreso de la Unión",
  "official_url": "https://www.diputados.gob.mx/LeyesBiblio/regley/Reg_LGS_MCSPIUMC_120121.pdf",
  "reference_url": "https://www.diputados.gob.mx/LeyesBiblio/regley/Reg_LGS_MCSPIUMC_120121.pdf",
  "retrieved_at": "2026-10-14T07:58:47.175088Z",
  "http_status": 200,
  "content_type": "application/pdf",
  "content_length": 349086,
  "etag": "\"5539e-5baef79162dc0\"",
  "last_modified": "Tue, 09 Feb 2021 23:16:15 GMT",
  "source_sha256": "2cc4bd6de7ab80102fae680a7017a0876b062f7999f7e33916b853cc8296cb19",
  "extracted_text_sha256": "ad341d2c1f40de76d176d48c3504248b15a76b4d6c5f7c8904ef913f369dce2f",
  "extraction_tool": "pdftotext version 26.09.0",
  "parser_version": "0.1.0",
  "schema_version_used": "0.1.0",
  "resulting_git_commit": "1a37ccde2e113e550d08a82bbead5620c9b6d868"
}