{
  "schema_version": "0.1.0",
  "instrument_id": "urn:lex-mx:federal:statute:lgt",
  "operational_source": "camara_de_diputados",
  "formal_publication_source": "dof",
  "publisher": "Cámara de Diputados del H. Congreso de la Unión",
  "official_url": "https://www.diputados.gob.mx/LeyesBiblio/pdf/LGT.pdf",
  "reference_url": "https://www.diputados.gob.mx/LeyesBiblio/ref/lgt.htm",
  "retrieved_at": "2026-10-14T07:36:44.341984Z",
  "http_status": 200,
  "content_type": "application/pdf",
  "content_length": 693288,
  "etag": "\"a9428-6450ed626f540\"",
  "last_modified": "Wed, 03 Dec 2025 16:38:05 GMT",
  "source_sha256": "266023204bad762583d7837b0359d869c41704fcaff52b9da6bb67071cee0ef3",
  "extracted_text_sha256": "aba74953613cda577462064885144f74a1b82d2e5d66ba43091d4531fbd31557",
  "extraction_tool": "pdftotext version 26.09.0",
  "parser_version": "0.1.0",
  "schema_version_used": "0.1.0",
  "resulting_git_commit": "1a37ccde2e113e550d08a82bbead5620c9b6d868"
}