{
  "schema_version": "0.1.0",
  "instrument_id": "urn:lex-mx:federal:regulation:reg-lfaebsp",
  "operational_source": "camara_de_diputados",
  "formal_publication_source": "dof",
  "publisher": "Cámara de Diputados del H. Congreso de la Unión",
  "official_url": "https://www.diputados.gob.mx/LeyesBiblio/regley/Reg_LFAEBSP.pdf",
  "reference_url": "https://www.diputados.gob.mx/LeyesBiblio/regley/Reg_LFAEBSP.pdf",
  "retrieved_at": "2026-08-01T06:28:33.135481Z",
  "http_status": 200,
  "content_type": "application/pdf",
  "content_length": 332308,
  "etag": "\"51214-563b487abce40\"",
  "last_modified": "Fri, 26 Jan 2018 21:25:05 GMT",
  "source_sha256": "9047ed3a46898bd7423b35e109f9c695e995408ca852aaaa07eb2cb902c9d7a3",
  "extracted_text_sha256": "d454a4daed4c13a2f8dd3198de7195a693f57a105b47f0a52be436c84157d8c1",
  "extraction_tool": "pdftotext version 26.07.0",
  "parser_version": "0.1.0",
  "schema_version_used": "0.1.0",
  "resulting_git_commit": "067d225f7a1b248a058979252c7468c1e448d6d1"
}